{"id":"mitsubishi","names":{"en":"三菱","zh":"三菱"},"slug":"mitsubishi","logo":"/images/brands/mitsubishi.svg","website":"","country":"CN","category":"fuel","description":{"en":"三菱 - available for export through PowerNowAuto.","zh":"三菱 - 可通过PowerNowAuto出口。"},"featured":false,"order":48,"vehicleCount":0}