{"id":"geely_galaxy","names":{"en":"吉利银河","zh":"吉利银河"},"slug":"geely_galaxy","logo":"/images/brands/geely_galaxy.svg","website":"","country":"CN","category":"nev","description":{"en":"吉利银河 - available for export through PowerNowAuto.","zh":"吉利银河 - 可通过PowerNowAuto出口。"},"featured":true,"order":10,"vehicleCount":0}