{"id":"chery_fengyun","names":{"en":"奇瑞风云","zh":"奇瑞风云"},"slug":"chery_fengyun","logo":"/images/brands/chery_fengyun.svg","website":"","country":"CN","category":"nev","description":{"en":"奇瑞风云 - available for export through PowerNowAuto.","zh":"奇瑞风云 - 可通过PowerNowAuto出口。"},"featured":false,"order":26,"vehicleCount":0}