{"id":"saic_maxus","names":{"en":"上汽大通","zh":"上汽大通"},"slug":"saic_maxus","logo":"/images/brands/saic_maxus.svg","website":"","country":"CN","category":"nev","description":{"en":"上汽大通 - available for export through PowerNowAuto.","zh":"上汽大通 - 可通过PowerNowAuto出口。"},"featured":false,"order":29,"vehicleCount":0}