{"id":"vw_id","names":{"en":"大众ID.系列","zh":"大众 ID. 系列"},"slug":"vw_id","logo":"/images/brands/vw_id.svg","website":"","country":"CN","category":"fuel","description":{"en":"大众 ID. 系列 - available for export through PowerNowAuto.","zh":"大众 ID. 系列 - 可通过PowerNowAuto出口。"},"featured":false,"order":35,"vehicleCount":0}